<?xml version="1.0" encoding="UTF-8"?>
<concessionari xmlns="https://elpuig.xeill.net/MP04/XSD" 
	xmlns:xsi="http://www.w3.org/2001/XMLSchema-instance" 
	xsi:schemaLocation="https://elpuig.xeill.net/MP04/XSD repaso.xsd">
	<cotxe marca="renault">
		<model>Capture</model>
		<nou valor="si"/>
		<color>Blanc</color>
	</cotxe>
	<cotxe marca="audi">
		<model>A3</model>
		<nou valor="si"/>
		<color>Vermell</color>
	</cotxe>
	<furgoneta marca="seat">
		<model>Ibiza</model>
		<nou valor="si"/>
		<color>Blau</color>
	</furgoneta>
</concessionari>